commit	primary_mhs	second_mhs	selftest	status	description
2d71af371	7245.9	NA	PASS	keep	baseline (master)
5c62e6e35	7285.3	NA	PASS	discard	reassociate SM3 round sums so late SS1/SS2 is last addend (shorten critical path); +0.54% within 1-2% noise. ncu: 97.5% ALU-bound roofline, 55% issue slots; SASS already optimal (maj FF1=single LOP3 0xe8, choice/xor single LOP3, single-SHF funnel rotates, adds offloaded to FMA pipe via IMAD.IADD, no hot-loop spills). rotates+logic irreducible for SM3.
9e92563a9	7251.2	NA	PASS	discard	hoist loop-invariant Wj=W[i]^W[i+4] (rounds 1-11, unexpanded W[1..15] are il_pos-invariant; only W[0] varies via w0r) out of the candidate loop in m31100_a3 m+s kernels; +0.07% within noise. LICM already hoists these (compiler scalarizes broadcast XOR of loop-invariant scalars). Confirms prior roofline finding: SM3 is ALU-pipe bound (ncu 97.5%), min instr count (pre-rotated Tj consts, single-LOP3 maj/choice, 2SHF+1LOP3 P0/P1, adds on FMA pipe via IMAD.IADD); <2.5% headroom means no keeper exists.
f1d8aad55	7250.2	NA	PASS	discard	#pragma unroll 2 on the il_pos candidate loop in m31100m/m31100s (a3-optimized) to expose cross-candidate ILP so the scheduler can overlap two independent SM3 dependency chains and hide rotate/ALU latency; +0.06% within 1-2% noise, selftest PASS. Confirms SM3 a3 is ALU/throughput-bound (not latency-bound) even at the autotuned vector width: the compiler already schedules enough ILP from the single fully-unrolled 63-round body, and doubling live message-schedule+state registers gained nothing (occupancy pressure). Reinforces prior roofline finding (ncu 97.5% ALU, min-instr: pre-rotated Tj consts, single-LOP3 FF1/GG1, 2SHF+1LOP3 P0/P1/EXPAND, adds fused via IADD3/IMAD.IADD). No keeper.
3b5d01191	7294.2	NA	PASS	discard	P1 msg-expansion rotate restructuring: derive rotl(x,23)=rotl(rotl(x,15),8) so both P1 rotations share a base (probe SHF pipe—the #1 bottleneck—for restructuring headroom). +0.67% vs baseline 7245.9, WITHIN noise band (prior no-op discards ranged 7250-7285), selftest PASS => discard. SASS (RTX 3090 sm_86, s04): SHF=561 + LOP3=480 + IADD3=196 saturate the single 64/clk INT datapath while FP32 datapath near-idle (compiler already offloads 106 adds via IMAD.IADD). Rotates dominate + are algebraically irreducible: each P0/P1 needs 2 distinct rotations of one value; deriving one from the other keeps count at 2 SHF, only lengthens latency (same pipe on sm_86). Compiler already specializes s04 for its 11 zero words (s04=1512 instr < s16=1592) and fuses 3-way XOR to single LOP3. No SHF-pipe headroom; confirms INT/ALU roofline (ncu 97.5%). 4th principled discard.
ca91bf849	7271.3	NA	PASS	discard	P0 rotate-base share on the round critical path: derive rotl(x,17)=rotl(rotl(x,9),8) so both P0 rotates share a base (probes SHF pressure on the true state recurrence h=P0(TT2), distinct from exp#6 which touched only the expansion/P1 path). +0.35% vs baseline 7245.9, WITHIN noise (prior discards 7250-7294), selftest PASS => discard. Confirms SHF is at the ALGORITHMIC MINIMUM: P0 rotation consts {9,17}, P1 {15,23}, state {12,9,19,7} are all distinct so no base-merge REDUCES SHF count (sharing keeps 2 SHF, only serializes r17<-r9 lengthening the critical-path latency). All rotates algorithmically mandatory; add-tree already IADD3+IMAD.IADD (FP-offloaded), logic single-LOP3. ncu 97.5% ALU roofline. 5th principled discard; SM3 confirmed at instruction-count roofline.
ca1c4cd61	7480.0	NA	PASS	keep	Offload P0/P1 second rotate to the PRMT byte-permute pipe: derive rotl(x,17)=rotl(rotl(x,9),8) and rotl(x,23)=rotl(rotl(x,15),8) as prmt.b32 (selector 0x2103 = rotl8) instead of a 2nd shf, in new vector helpers sm3_p0_prmt/sm3_p1_prmt (inc_hash_sm3.cl) called from SM3_P0/SM3_P1 macros. Value-identical (byte rotate = bit rotate by 8; selftest PASS). +3.2% vs baseline 7245.9 (7480.0, confirm 7477.6), FAR beyond noise band (all 5 prior no-op discards were 7250-7294). FIRST KEEPER for SM3: overturns the prior roofline conclusion. Root cause: prmt executes on a distinct issue port from shf.l.wrap on sm_86 (RTX 3090), so moving 1 of every 2 rotates in P0 (64x/hash) and P1 (51x/hash) off the SHF-saturated INT/ALU datapath (~115 of 561 shf) directly relieves the #1 bottleneck. Same instruction count (1 shf+1 prmt+1 LOP3 vs 2 shf+1 LOP3) so no regression risk; the latency serialization (r17<-r9) that sank the SHF-only sharing exps #4/#5 is hidden because a3 is throughput-bound. Next: same trick on rotl(d,7)/rotl(c,15) has no by-8 partner to share, but exploring prmt for rotl16/rotl24-adjacent state rotates may yield more.
fdc4c9b2f	7592.8	NA	PASS	discard	Split a3 single-hash round 60 after TT1 and perform the d early-reject before TT2, b/f rotates, and P0, so rejected candidates can skip the unused half-round; value-identical for surviving lanes. +1.51% vs current best 7480.0, within the stated ~1-2% noise band, selftest PASS; discard.
66d7ff913	7543.0	NA	PASS	discard	Cache each schedule word's rotl15 from its W[j-3] use and ten expansions later derive the same word's rotl7 as PRMT rotate-right-by-8 in the a3 single-hash kernel, replacing 39 hot-path SHF rotates with PRMT while preserving values. +0.84% vs current best 7480.0, within the 1-2% noise band; selftest PASS, discard (cache live ranges likely offset pipe relief).
