commit	primary_mhs	second_mhs	selftest	status	description
2d71af371	1913.0	NA	PASS	keep	baseline (master)
21b741b53	2100.2	NA	PASS	keep	Fold Theta D-application into per-lane 3-input XOR (a = a ^ bc ^ rotl) in the main round loop of both m/s fns, dropping the separate t = bc[x-1] ^ rotl(bc[x+1],1) materialization; ptxas emits 1 XOR3 (LOP3) per lane = 5 LOP3/column vs 6 (t + 5 applies). Value-identical XOR reassoc, selftest PASS. +9.78% (2100.2) vs baseline 1913.0. Proven Keccak/SHA3-family lever (17400 +10.8%, 17800 +5.2%); Keccak-224 transfers at +9.78%. Directly cuts dynamic LOP3, the known ALU-bound (98.9% ALU) roofline for this shared kernel. Left the already-pruned final peeled Theta untouched. Next candidate: peel round 0 to constant-fold mostly-zero init (+2.3%/+2.9% on siblings).
278d9c11a	2164.6	NA	PASS	keep	Peel Keccak round 0 in m17700 a3 m/s helpers while preserving the existing XOR3 Theta form; rounds 1-22 stay rolled and the final peeled round is unchanged. Initial state has 16 zero lanes plus one constant lane, so straight-line round 0 lets the compiler fold zero/constant work. +3.07% vs prior best 2100.2, selftest PASS.
5afc688b9	2067.6	NA	PASS	discard	Fold final partial-round Theta D-application into per-lane 3-input XOR3 in m17700 a3 m/s helpers, matching the kept steady-state form for only live output lanes. Value-identical XOR reassoc and selftest PASS, but 2067.6 vs best 2164.6 is -4.48%, clearly outside the noise band negative; final-round expression shape is not a lever.
356f9fd14	2164.5	NA	PASS	discard	Prune final Rho-Pi tail in m17700 a3 m/s helpers by computing only post-RhoPi a02/a03/a04 directly from a22/a33/a44 before final Chi. Value-identical final-round dead-lane elimination, selftest PASS, but 2164.5 vs best 2164.6 is unchanged within noise; no keep-worthy gain.
44e790f08	2163.4	NA	PASS	discard	Collapse final partial Keccak round in m17700 a3 m/s helpers to directly compute post-RhoPi row lanes b0/b2/b3/b4 from the four needed Theta D values, skipping intermediate lane updates and the Rho-Pi cycle. Selftest PASS, but 2163.4 vs best 2164.6 is within noise/slightly lower; no keep-worthy gain.
36f180b56	2163.0	NA	PASS	discard	Force unconditional pragma unroll on the remaining a3 Keccak rounds (1-22) in both m/s helpers after the kept round-0 peel. Selftest PASS, but 2163.0 vs best 2164.6 is unchanged/slightly lower within noise; loop unroll is not a keep-worthy gain.
8444653a6	2163.5	NA	PASS	discard	Inline final partial-round Chi operands directly in m17700 a3 m/s helpers, removing redundant bc0/bc2/bc3/bc4 snapshot assignments; value-identical because the second assignment does not read updated a02. Selftest PASS, but 2163.5 vs best 2164.6 is unchanged within noise; no keep-worthy gain.
c551651ce	2165.0	NA	PASS	discard	Split the 24-lane Rho-Pi cycle into two independent 12-lane chains in the peeled round 0 and steady-state loop of both m/s helpers, exposing ILP while preserving values through disjoint lane cycles. Selftest PASS, but 2165.0 vs best 2164.6 is +0.02%, firmly within noise; no keep-worthy gain.
