commit	primary_mhs	second_mhs	selftest	status	description
2d71af371	1894.4	NA	PASS	keep	baseline (master)
21fffee97	1992.1	NA	PASS	keep	Theta D-apply as explicit 3-input XOR (1 LOP3/lane, drop t-build); +5.2% over baseline
966d1043a	2049.1	NA	PASS	keep	peel round 0 to constant-fold mostly-zero init state; +2.9% over Theta-XOR3 best
b5fe7388f	2045.6	NA	PASS	discard	Split the single 24-lane Rho-Pi serial dependency cycle into two independent 12-lane chains (2nd seeded from pre-permute a04), exposing 2x ILP; applied to peel-round-0 + main-loop in both m/s fns. Value-identical (disjoint lane sets, seeds captured pre-write); selftest PASS. 2045.6 vs best 2049.1 = -0.17% (within noise). Rho-Pi chain latency is NOT on the critical path => kernel is throughput/LOP3-pipe-bound, not latency-bound; the 17400 roofline (98.9% ALU) transfers. First principled discard for 17800; 2049-vs-2147(17400) gap is cross-session noise.
966d1043a	2048.8	NA	PASS	roofline	No kernel change. SASS instruction-selection audit of the autotuned m17800_s04 (vec4) hot round-loop (0xec0-0x26a0): 260 LOP3 + 116 SHF + exactly 1 each MOV/IMAD/IADD3/ISETP (pure loop-counter overhead) -> zero stray MOV/IMAD, Rho_Pi shuffle macro fully register-renamed by ptxas. This was program.md last unchecked lever (no stray MOV/IMAD in hot loop), now confirmed clean. With the transferred ncu profile (98.9% ALU, register-limited; kernel byte-identical to 17400) and ruled-out levers (Theta-XOR3 + peel-round-0 already kept; Rho-Pi ILP-split, separate-D-temps, PRMT/SHF-offload, occupancy, bit-interleave, full-unroll all no-help/regress), 17800 is at the ALU/LOP3 roofline. Logical LOP3/round = parity 10 + D-apply 25 + Chi 25 + Iota 1 = 61, algebraically minimal for Keccak-f[1600]. No untried lever with a plausible mechanism remains. HEAD unchanged at best 966d1043a; measured 2048.8 == best 2049.1 within noise.
0b92db0d7	2068.8	NA	PASS	discard	Partially unroll the 22-round hot Keccak loop by factor 2 in m/s functions to halve loop-control overhead without full-unroll code growth. Selftest PASS; 2068.8 vs best 2049.1 = +0.96%, within the 1-2% noise band, so no demonstrated gain.
720252136	2061.8	NA	PASS	discard	Source-specialize peeled round-0 Theta in m/s functions: simplify parity to initially nonzero lanes and assign initially zero lanes directly from D. Value-identical; selftest PASS. 2061.8 vs best 2049.1 = +0.62%, within the 1-2% noise band, so no demonstrated gain.
