commit	primary_mhs	second_mhs	selftest	status	description
2d71af371	1176.7	NA	PASS	keep	baseline (master)
7c0c1816e	1134.2	NA	PASS	discard	RC4 KEY8/KEY32 disjoint-bitfield address composition + -> | : regressed -3.6% (1176.7->1134.2), selftest PASS; ptxas prefers IADD3/LEA fusion of the + address arith with byte-addr generation over separate LOP3s here -- the proven-elsewhere KEY8 | lever does NOT transfer to m9800
423b11b4c	1160.4	NA	PASS	discard	rc4_next_16 PRGA: reuse swapped bytes sa/sb for id=S[a]+S[b] instead of reloading post-swap from shared (value-identical, commutative sum; saves 2 shared loads/keystream-byte + removes store->reload from crit path). Regressed -1.4% (1176.7->1160.4), selftest PASS. Keystream is only 32 bytes vs 256-step KSA so LSU savings are small, and the 2 extra live u8 temps/unroll cost occupancy in this register-limited (8 blk/SM) latency-bound kernel -- net negative. LSU-cut lever does not help the PRGA tail here.
1fd35dea6	1160.5	NA	PASS	discard	version-3 40-bit RC4 KSA specialization (rc4_init_128_40): drop byte-extract+add of the runtime-zero key bytes 5-15 for 11/16 KSA steps (value-identical since digest is masked digest[1]&=0xff,digest[2]=digest[3]=0), version-guarded so v4 keeps general rc4_init_128. Regressed -1.4% (1176.7->1160.5), selftest PASS. KSA is LSU-latency-bound not ALU-bound (SM Busy 40.6%, LSU 66.9%); the removed adds sit off the S[idx]-load-gated critical path (S[idx]+d precomputed before j arrives), so 176 fewer ALU adds net nothing and the extra live state / lost CSE cost a hair. KSA ALU-reduction lever CLOSED for m9800; same -1.4% floor as the PRGA reload-elim discard.
e1b6ad06d	1175.5	NA	PASS	discard	rc4_init_128 KSA main loop forced ROLLED via #pragma unroll 1 (16 trips of 16-step static-key body) instead of ptxas full 256-step unroll, to cut register/I-cache pressure and lift occupancy on this register-limited (8 blk/SM, occ 16.7pct) latency-bound kernel. Value-identical, selftest PASS. FLAT -0.1pct (1176.7->1175.5): rolling the KSA does not reduce kernel-wide max registers because the ceiling is set by the SHA1 transform peaks (16-word W schedule + password->scratch copy live at loop-top SHA1 #1/#2), NOT the KSA region; occupancy unchanged. pass_hash live-range recompute also dead-ends (recomputing SHA1 #1 in the cold 2nd-block branch needs the 16-word password held live = net +11 regs, so ptxas already-optimal). m9800 at practical roofline: LSU-latency-bound, occupancy walled by structurally-necessary SHA1 reg peaks; KSA/PRGA op-count and 2-serial-load critical path at floor; all micro-levers (KEY8-fold, PRGA/KSA reload-elim, v3-specialization, KSA-roll) discarded.
37854c6df	1266.5	NA	PASS	keep	version-3 first RC4 key setup: defer digest[2]/digest[3] hc_swap32_S into the version-4 else path, so v3 zero-key path skips two byte-swaps before rc4_init_128 while preserving identical digest[2]=digest[3]=0 semantics. Improved +7.6pct (1176.7->1266.5), selftest PASS; keep.
a67f7fd59	1175.6	NA	PASS	discard	version-3 40-bit RC4 key byte extraction: replace hc_swap32(digest[1])&0xff with digest[1]>>24 and move full digest[1] swap into v4 branch across m09800 optimized kernels. Regressed -7.2% (1266.5->1175.6), selftest PASS; ptxas likely already folded the swap+mask path better or branch/live-range cost outweighed one byte extraction.
