commit	primary_mhs	second_mhs	selftest	status	description
2d71af371	1913.0	NA	PASS	keep	baseline (master)
f8efce00e	2092.8	NA	PASS	keep	Theta D-apply as explicit 3-input XOR3 (5 LOP3/col not 6); +9.4% over baseline
53813bf1f	2168.6	NA	PASS	keep	peel round 0 to fold known-zero/constant init lanes; +3.6% over Theta-XOR3 best (2092.8->2168.6)
6459d40b6	2167.3	NA	PASS	discard	force Theta column parity to explicit XOR3 (hc_lop_0x96) in steady-state rounds; no change (2168.6->2167.3, within noise) => ptxas already fuses 5-input parity chain to 2 XOR3
961632f8b	2165.9	NA	PASS	discard	prune final round to only output-relevant lanes (a00/a22/a33/a44 -> a02/a03/a04 via 3 direct rotates), drop 18-step Rho-Pi t-chain + dead D-applies; value-identical, selftest PASS but 2168.6->2165.9 = -0.12%, within noise (last round ~1/24 of work)
7cbe7f59c	2167.0	NA	PASS	discard	partial unroll main round loop by 2 (#pragma unroll 2); 2168.6->2167.0 = -0.07% within noise => loop overhead NOT a lever on this ALU/LOP3-saturated kernel (per-round branch+counter-add negligible vs ~61 LOP3/round); steady-state already at LOP3 floor (10 parity + 25 D-apply + 25 Chi + 1 iota, all min/XOR3-fused), occupancy capped by irreducible 25-lane state => at roofline
88abeb53f	2124.7	NA	PASS	discard	explicitly specialize peeled round-0 Theta for known zero/constant lanes and alias equal D results; 2168.6->2124.7 = -2.02% regression => source-level aliasing/CSE worsens scheduling or register allocation versus compiler constant folding
2f9c628dc	2215.9	NA	PASS	keep	peel round 22 from rolled loop with literal Iota constant to improve scheduling into final round; 2168.6->2215.9 = +2.18%
