commit	primary_mhs	second_mhs	selftest	status	description
2d71af371	188.8	NA	PASS	keep	baseline (master)
81b94d451	194.0	NA	PASS	keep	precompute constant key schedule of first g-call (h==IV, message never enters k); 13x64 shared table loads/candidate -> constants; +2.75% (188.8->194.0); LSU-bound, bank-conflicts ~0, rotation trick verified N/A
2a435cd84	195.1	NA	PASS	discard	hoist loop-invariant round-0 table-0..6 s-box lookups of first g-call out of a3 candidate loop (only m[7] carries varying mask word); +0.57% (194.0->195.1) within ~1-2% noise band; ncu confirms roofline (Compute-SM 99.7% AND Memory 99.7% simultaneously, occupancy register-capped at 1 block/SM so pre[] register pressure offsets saved loads); rotation table-compression trick N/A (popcount mismatch across sl64 tables)
f176d202c	199.5	NA	PASS	keep	prune final compression (3rd/last g-call streebog_g_last): only h[0],h[1] feed r0..r3 compare, so round 11 computes only output words 0,1 of s- and k-chains instead of all 8; removes 2*6*8=96 shared s-box loads/candidate (2.42% of 3968); rolled `for r` loop cannot DCE the dead final-round outputs itself; +2.84% (194.0->199.5), selftest PASS
313aff06f	199.3	NA	PASS	discard	force-roll (#pragma unroll 1) the three g-round loops (12/12/11 iters) to cut cross-iteration register pressure; 199.5->199.3 (-0.1%, within noise band), selftest PASS; round loops are strictly sequential (each round depends on prior s,k) so NVRTC default unroll gives ~no ILP and wasnt inflating registers -> occupancy stays register-floored at 1 block/SM; no occupancy change, confirms roofline / register-occupancy lever exhausted
60304808d	199.2	NA	PASS	discard	force #pragma unroll on data-parallel LPS inner loops (define _unroll) for MLP across shared s-box loads; 199.5->199.2 (-0.15%, within 1-2% noise), selftest PASS; no-op: NVRTC already fully unrolls these trip-count-8 loops by default, and kernel is LSU-throughput+compute co-saturated (ncu 99.7%/99.7% exp2/exp4) so extra MLP cannot help a load-throughput-bound chain; reinforces roofline -- only load-REDUCING levers help and those are exhausted (terminal-output prune done exp3; table-compression N/A popcount; MDS full-diffusion blocks input-sparsity; zero-lane immediate-fold is m04-specific/correctness-unsafe)
29d2d399f	199.4	NA	PASS	discard	fold INITVAL into precomputed final-round const of streebog_g_first: final xor of h==IV first compression becomes 3-input s^const^m instead of 4-input INITVAL^s^k^m (saves 2 LOP3/word/candidate, once per candidate); 199.5->199.4 (-0.05%, within 1-2% noise band), selftest PASS, value-identical. Confirms compute-side roofline -- this was the last constant-fold opportunity; hot round loop already lowers to minimal LOP3/SHF/LDS. Structural levers exhausted: output-prune impossible for comp1/comp2 (all 8 output words feed next LPS(h)), key-precompute impossible for comp2/comp3 (candidate-dependent h), table-compression N/A (Streebog L is general MDS not circulant, no rotation relation per exp2 popcount), rc64 already constant mem, occupancy register-floored (exp5).
560b00842	201.7	NA	PASS	discard	m04/s04-specialize round 0 of first compression: m[0..5] are provably zero, so fold their six table contributions into eight constants and retain only table 6/7 lookups; removes 48 shared loads/candidate without the register-heavy loop-invariant hoist tried earlier; 199.5->201.7 (+1.10%), within ~1-2% noise band, selftest PASS
9ea8d41ae	220.5	NA	PASS	keep	reuse the 8-word vector message buffer for the middle length-block compression, then reconstruct the original message before the final compression; shortens the original vector message live range across the register-heavy middle g-call and removes the simultaneous m+z live arrays; 199.5->220.5 (+10.53%), beyond noise, selftest PASS
