commit	primary_mhs	second_mhs	selftest	status	description
2d71af371	1376.4	NA	PASS	keep	baseline (master)
05b0a0ed2	1124.3	NA	PASS	discard	RC4 KEY8/KEY32 disjoint-bitfield +->| : value-identical (selftest PASS) but -18.3% REGRESSION; addressing is on RC4 serial dep chain, forcing LOP3 over IADD3/address-fold adds a chain hop x~1200 serial shared accesses/candidate; documented +4.6% RC4 win does NOT transfer to 18200
4e0d6d97b	1375.6	NA	PASS	discard	RC4 keystream post-swap reload elim: idx=Sa+Sb (swap-invariant S[a]+S[b]) computed from pre-swap loads, drops 2 dependent shared loads/byte in rc4_next_16/_global/dropN. Value-identical (selftest PASS) but FLAT 1375.6 vs 1376.4 baseline (-0.06%, in noise). Keystream is only 16B/candidate on the common early-reject path; KSA 256 swaps + MD4/2xHMAC-MD5 ALU dominate and ptxas already hid the reload latency. The documented m18200 real lever does NOT move the needle.
2d71af371	1379.2	NA	PASS	roofline	ncu direct profile (FIRST for 18200; prior rounds only inferred from m9800/m5600 siblings): LATENCY-bound - Compute(SM)=Memory=68.58% (equal AND unsaturated), Executed IPC 1.48, Issue Slots 37%; achieved occ 21.35% (theo 22.92%) HARD-CAPPED by shared memory (Block Limit ShMem=11 < Reg=12 < SM=16). Shared = RC4 S-box only, 256B/thread=8KB/warp, IRREDUCIBLE (256-entry random-indexed permutation is uncompressible) -> register reduction is futile (shared binds occupancy first). All RC4 levers CLOSED: KSA at 2LDS+2STS/byte swap floor + irreducibly serial j-dep chain (cannot prefetch S[i+1], a prior swap may have overwritten it); keystream post-swap reload-elim tested FLAT (4e0d6d97b, only 16B/candidate on reject path); +->| KEY8 addressing fold tested -18.3% (05b0a0ed2, adds LOP3 hop to serial chain); key-byte hoist = ptxas LICM no-op. MD4 + 2x HMAC-MD5 keys all per-candidate (no precompute possible), 8 MD5 transforms irreducible. Latency/occupancy ROOFLINE for this GPU; no edit.
1ba15f830	1403.8	NA	PASS	keep	A3 optimized early ASN.1 reject helper skips nonce keystream output and decrypts only bytes 8-12 before RC4 reinit; +2.0% vs 1376.4 baseline, outside noise band with selftest PASS
afdda591c	1403.8	NA	PASS	discard	A3 early RC4 inline swap caches Sa/Sb in asrep_early_check; value-identical but flat vs 1403.8 best, within noise; no keep
948f8dba6	1419.0	NA	PASS	discard	progressive ASN.1 early reject returns after first required 0x79 byte; selftest PASS and +1.08% vs 1403.8 best, inside ~1-2% noise band so discard
41c7d2946	1461.7	NA	PASS	keep	A3 hoist invariant ASN.1 ciphertext words edata2[2:3] outside candidate loop and pass as scalars; value-identical, selftest PASS, +4.1% vs 1403.8 best and outside noise band
2a7f3d26e	1442.6	NA	PASS	discard	A3 hoist invariant password 0x80 padding outside candidate loop; value-identical (OR-associative with BFS modifier) but -1.31% vs 1461.7 best, so discard
